{
  "pattern": "question_led",
  "nodes": [
    {"id": "N01", "type": "PROBLEM", "text": "Forecasters normalized with training statistics lose accuracy when the series level shifts after deployment."},
    {"id": "N02", "type": "SIGNIFICANCE", "text": "Level shifts occur in deployed load forecasting [CITATION NEEDED], so the error matters in practice."},
    {"id": "N03", "type": "KNOWN", "text": "Standard pipelines normalize with training-set mean and std [CITATION NEEDED]."},
    {"id": "N04", "type": "GAP", "text": "In the evaluations examined, normalization and capacity were changed together, so the source of shift error is not separated [search not yet run]."},
    {"id": "N05", "type": "RQ", "text": "RQ1: Does per-window normalization reduce error under level shift without harming unshifted accuracy?"},
    {"id": "N06", "type": "RQ", "text": "RQ2: How much of the gain depends on continuing to adapt the statistics?"},
    {"id": "N07", "type": "HYPOTHESIS", "text": "Stale statistics drive the error; RWN removes most of it at no unshifted cost.", "claims": ["C006"]},
    {"id": "N08", "type": "APPROACH", "text": "Rolling-window normalization (RWN) with capacity held fixed."},
    {"id": "N09", "type": "DESIGN", "text": "Shift sweep: s in {0, 0.2, 0.4, 0.6, 0.8}, 3 methods, 5 seeds, same MLP."},
    {"id": "N10", "type": "DESIGN", "text": "Ablation: RWN-fixed freezes statistics after first post-shift window (s = 0.6)."},
    {"id": "N11", "type": "RESULT", "text": "No unshifted cost.", "claims": ["C001"], "evidence": ["E001", "E002"]},
    {"id": "N12", "type": "RESULT", "text": "11-29% MAE reduction for s ≤ 0.6.", "claims": ["C002"], "evidence": ["E003", "E004"]},
    {"id": "N13", "type": "RESULT", "text": "No clear benefit at s = 0.8.", "claims": ["C003"], "evidence": ["E005"]},
    {"id": "N14", "type": "RESULT", "text": "Two thirds of gain from re-estimating stats; one third from continued adaptation.", "claims": ["C004"], "evidence": ["E006"]},
    {"id": "N15", "type": "INTERPRETATION", "text": "RQ1 answered yes for moderate shifts only.", "claims": ["C001", "C002", "C003"]},
    {"id": "N16", "type": "INTERPRETATION", "text": "Stale statistics rather than capacity account for much of the error (suggestive).", "claims": ["C005"]},
    {"id": "N17", "type": "INTERPRETATION", "text": "RQ2: continued adaptation contributes about a third.", "claims": ["C004"]},
    {"id": "N18", "type": "CONTRIBUTION", "text": "Capacity-controlled evidence that per-window normalization removes most level-shift error up to s = 0.6, with its boundary and an attribution of the gain.", "claims": ["C002", "C003", "C004"]},
    {"id": "N19", "type": "LIMITATION", "text": "Synthetic data only.", "claims": ["C002"]},
    {"id": "N20", "type": "LIMITATION", "text": "Capacity held fixed, not varied.", "claims": ["C005"]},
    {"id": "N21", "type": "FUTURE", "text": "Real load data; larger models.", "claims": ["C007"]},
    {"id": "N22", "type": "BACKGROUND_CONCEPT", "text": "Level shift (in training-std units); mean absolute error."}
  ],
  "edges": [
    {"from": "N01", "to": "N05", "type": "motivates"},
    {"from": "N02", "to": "N05", "type": "motivates"},
    {"from": "N03", "to": "N04", "type": "establishes"},
    {"from": "N05", "to": "N04", "type": "addresses"},
    {"from": "N06", "to": "N04", "type": "addresses"},
    {"from": "N07", "to": "N05", "type": "operationalizes"},
    {"from": "N08", "to": "N07", "type": "implements"},
    {"from": "N09", "to": "N07", "type": "tests"},
    {"from": "N09", "to": "N11", "type": "produces"},
    {"from": "N09", "to": "N12", "type": "produces"},
    {"from": "N09", "to": "N13", "type": "produces"},
    {"from": "N10", "to": "N14", "type": "produces"},
    {"from": "N11", "to": "N15", "type": "supports"},
    {"from": "N12", "to": "N15", "type": "supports"},
    {"from": "N13", "to": "N15", "type": "contradicts"},
    {"from": "N12", "to": "N16", "type": "supports"},
    {"from": "N14", "to": "N16", "type": "supports"},
    {"from": "N14", "to": "N17", "type": "supports"},
    {"from": "N15", "to": "N05", "type": "answers"},
    {"from": "N17", "to": "N06", "type": "answers"},
    {"from": "N12", "to": "N18", "type": "grounds"},
    {"from": "N04", "to": "N18", "type": "grounds"},
    {"from": "N19", "to": "N18", "type": "limits"},
    {"from": "N20", "to": "N16", "type": "limits"},
    {"from": "N19", "to": "N21", "type": "opens"},
    {"from": "N05", "to": "N22", "type": "requires"}
  ],
  "experiment_chains": [
    {"experiment": "shift_sweep", "rq": "N05", "hypothesis": "RWN lowers error under shift with no unshifted cost",
     "falsifier": "RWN no better than baseline under shift, or worse without shift",
     "design_rationale": "Same model and budget for all methods isolates normalization from capacity",
     "observations": ["E001", "E002", "E003", "E004", "E005"], "claims": ["C001", "C002", "C003"], "limitations": ["L001", "L003"],
     "next": "If RWN helps, is it re-estimating the statistics at all, or continually adapting them? -> ablation"},
    {"experiment": "ablation_fixed_window", "rq": "N06", "hypothesis": "Continued adaptation matters beyond a one-off re-estimate",
     "falsifier": "RWN-fixed matches RWN",
     "design_rationale": "Freezing statistics after one window removes adaptation while keeping post-shift re-estimation",
     "observations": ["E006"], "claims": ["C004"], "limitations": ["L003"],
     "next": "Last experiment; discussion interprets both"}
  ]
}
