{
  "pattern": "question_led",
  "nodes": [
    {"id": "N01", "type": "PROBLEM", "text": "Developing and evaluating AI agents that act through software interfaces (code execution, terminal, browser) requires infrastructure that is costly to build and to run at benchmark scale.", "claims": ["C020"], "evidence": ["E004", "E035"]},
    {"id": "N02", "type": "SIGNIFICANCE", "text": "As agents become more capable, systematic evaluation before wide deployment matters for identifying and addressing risks.", "claims": ["C015"], "evidence": ["E031"]},
    {"id": "N03", "type": "KNOWN", "text": "Multiple existing agent systems (e.g., the WebArena Agent baseline, SWE-Bench and web-browsing baselines reported in the evidence) each target a narrow benchmark family with their own harness.", "claims": [], "evidence": ["E009", "E010", "E011", "E020"], "sources": ["SRC-001"]},
    {"id": "N04", "type": "GAP", "text": "No single open platform in the evidence integrates a common agent abstraction with a broad set of benchmarks so one agent can be assessed across domains under one framework.", "claims": ["C001", "C011"], "evidence": ["E004", "E030"]},
    {"id": "N05", "type": "RQ", "text": "Can one open platform with a common agent-action interface host a single generalist agent that is evaluated, without per-domain prompt changes, across software-engineering, web-browsing, and miscellaneous-assistance tasks, reaching measurable performance in each?", "claims": [], "evidence": []},
    {"id": "N06", "type": "OBJECTIVE", "text": "Build such a platform (OpenHands) and evaluate one generalist agent across 15 integrated benchmarks spanning the three task categories.", "claims": ["C011"], "evidence": ["E030"]},
    {"id": "N07", "type": "APPROACH", "text": "Provide a minimal common agent-action abstraction, a containerized and reproducibly-tagged runtime, and a deterministic integration-test framework, then attach benchmark harnesses to it.", "claims": ["C001", "C018", "C019"], "evidence": ["E004", "E038", "E039"]},
    {"id": "N08", "type": "DESIGN", "text": "Run the same CodeActAgent (and a BrowsingAgent variant for web tasks) with no system-prompt modification across SWE-Bench Lite, HumanEvalFix, BIRD, WebArena, MiniWoB++, GAIA, GPQA, AgentBench, MINT, ProofWriter, and Entity Deduction Arena.", "claims": ["C006"], "evidence": ["E041"]},
    {"id": "N09", "type": "RESULT", "text": "On SWE-Bench Lite (300 instances, no hints), CodeActAgent v1.8 reaches 26.0% with claude-3.5-sonnet, 22.0% with gpt-4o, and 6.3% with gpt-4o-mini.", "claims": ["C002", "C003"], "evidence": ["E005", "E006", "E007", "E034"]},
    {"id": "N10", "type": "RESULT", "text": "On the HumanEvalFix Python subset (164 instances), CodeActAgent v1.5 fixes 79.3% of bugs in a 0-shot, multi-turn self-debugging setting.", "claims": ["C004", "C005"], "evidence": ["E008", "E036"]},
    {"id": "N11", "type": "RESULT", "text": "On WebArena (812 instances) and MiniWoB++ (125 environments), BrowsingAgent v1.0 reaches 8.5-15.5% and 40.8% success respectively, depending on the backend model.", "claims": ["C007"], "evidence": ["E017", "E018", "E019", "E020", "E021"]},
    {"id": "N12", "type": "RESULT", "text": "On miscellaneous-assistance benchmarks, CodeActAgent v1.5/v1.8 reaches 52.0% on GPQA diamond, 77.3% on MINT math, 78.8% on the challenging ProofWriter subset, and 57.6% on the AgentBench OS subset.", "claims": ["C008", "C009", "C010"], "evidence": ["E023", "E024", "E025", "E026", "E028"]},
    {"id": "N13", "type": "INTERPRETATION", "text": "The same unmodified agent produces interpretable results in every task category, consistent with a shared agent interface and one generalist agent being sufficient to obtain cross-domain performance figures; the size of each figure depends strongly on the backend model.", "claims": ["C006", "C003"], "evidence": []},
    {"id": "N14", "type": "CONTRIBUTION", "text": "An open, MIT-licensed platform with a minimal agent-action interface, a reproducible runtime, and harnesses for 15 benchmarks, demonstrated with one generalist agent evaluated across all of them without per-domain modification.", "claims": ["C001", "C011", "C012"], "evidence": ["E030", "E043"]},
    {"id": "N15", "type": "LIMITATION", "text": "Performance is highly sensitive to the backend LLM, most results use reduced-size benchmark subsets for cost reasons, agents still struggle with complex tasks and long-file editing, and building new workflows still requires substantial handcrafted effort. (Limitation IDs L001-L004 in claims/claim_evidence_map.json; this node lists the claims those limitations bound.)", "claims": ["C002", "C003", "C006", "C007", "C013", "C014"], "evidence": ["E005", "E006", "E035", "E032", "E033"]},
    {"id": "N16", "type": "IMPLICATION", "text": "A shared open platform lets researchers compare agents and run systematic, reproducible evaluation across domains rather than building bespoke harnesses, which also supports evaluating risk before deployment.", "claims": ["C015"], "evidence": ["E031"]},
    {"id": "N17", "type": "FUTURE", "text": "Improve agents' file-editing performance on long files and explore more automated (e.g., graph-based) workflow construction to reduce handcrafted engineering effort.", "claims": ["C013", "C014"], "evidence": ["E032", "E033"]},
    {"id": "N18", "type": "BACKGROUND_CONCEPT", "text": "An 'agent' here is a loop that observes environment state and emits actions from a small typed set (running code, running a shell command, or interacting with a browser); a 'generalist agent' uses one fixed configuration across task types instead of a per-benchmark configuration.", "claims": ["C001"], "evidence": ["E004"], "audience_note": "Adjacent-field readers may know 'agent' only in the RL sense; this defines the software-interaction sense used throughout."}
  ],
  "edges": [
    {"type": "motivates", "from": "N01", "to": "N05"},
    {"type": "motivates", "from": "N02", "to": "N05"},
    {"type": "establishes", "from": "N03", "to": "N04"},
    {"type": "addresses", "from": "N05", "to": "N04"},
    {"type": "operationalizes", "from": "N06", "to": "N05"},
    {"type": "implements", "from": "N07", "to": "N06"},
    {"type": "requires", "from": "N07", "to": "N18"},
    {"type": "tests", "from": "N08", "to": "N05"},
    {"type": "produces", "from": "N08", "to": "N09"},
    {"type": "produces", "from": "N08", "to": "N10"},
    {"type": "produces", "from": "N08", "to": "N11"},
    {"type": "produces", "from": "N08", "to": "N12"},
    {"type": "supports", "from": "N09", "to": "N13"},
    {"type": "supports", "from": "N10", "to": "N13"},
    {"type": "supports", "from": "N11", "to": "N13"},
    {"type": "supports", "from": "N12", "to": "N13"},
    {"type": "answers", "from": "N13", "to": "N05"},
    {"type": "grounds", "from": "N09", "to": "N14"},
    {"type": "grounds", "from": "N04", "to": "N14"},
    {"type": "limits", "from": "N15", "to": "N13"},
    {"type": "limits", "from": "N15", "to": "N14"},
    {"type": "implies", "from": "N13", "to": "N16"},
    {"type": "opens", "from": "N15", "to": "N17"},
    {"type": "opens", "from": "N16", "to": "N17"}
  ],
  "experiment_chains": [
    {"experiment": "SWE-Bench Lite (software engineering)", "rq": "N05", "hypothesis": "A generalist agent, unmodified, can resolve a meaningful fraction of real GitHub issues.", "design_rationale": "300 instances, no hint text, 3 backend models compared, to isolate the effect of the backend model from the agent design", "observations": ["N09"], "claims": ["C002", "C003"], "limitations": ["L001", "L002"], "next": "establishes the effect on code-editing tasks -> checks whether the same agent transfers to a very different domain (web browsing)"},
    {"experiment": "WebArena / MiniWoB++ (web browsing)", "rq": "N05", "hypothesis": "The same style of agent, adapted to a browsing action, can complete realistic web tasks without domain-specific prompting.", "design_rationale": "812 WebArena instances + 125 MiniWoB++ environments, zero-shot, 3 backend models, to test transfer beyond code", "observations": ["N11"], "claims": ["C007"], "limitations": ["L001", "L006"], "next": "establishes cross-domain transfer -> checks generality beyond code/web to reasoning and tool-use tasks"},
    {"experiment": "GPQA / MINT / ProofWriter / AgentBench (miscellaneous assistance)", "rq": "N05", "hypothesis": "The generalist agent's tool use and multi-turn reasoning generalize to graduate-level QA, math with tool feedback, and logical deduction.", "design_rationale": "198-2294 instances across four benchmarks, gpt-4o/claude-3.5-sonnet, to cover reasoning tasks unlike code or web browsing", "observations": ["N12"], "claims": ["C008", "C009", "C010"], "limitations": [], "next": "completes the three-domain narrative that grounds the CONTRIBUTION"}
  ]
}
